{
  "schema": "qw5.tb5-synchronization-evidence/v1",
  "artifact_role": "schema_fixture",
  "evidence_class": "SIMULATED",
  "created_at": "2000-01-01T00:00:00Z",
  "producer": {
    "name": "qw5-schema-fixture", "version": "1",
    "executable_sha256": "1818181818181818181818181818181818181818181818181818181818181818",
    "qw5_commit": "1818181818181818181818181818181818181818", "dirty": false,
    "parameters": ["--fixture"]
  },
  "plan_sha256": "2222222222222222222222222222222222222222222222222222222222222222",
  "cell_id": "stream:duplex-a-b:64",
  "scenario_id": "duplex-a-b",
  "attempt_id": "sample-001",
  "method": "coordinator_observed_window_v1",
  "coordinator": {
    "node": "A", "clock_id": "mach_continuous_time", "clock_resolution_ns": 50,
    "release_monotonic_ns": 10000000000
  },
  "participants": [
    {
      "flow_id": "a-b", "worker_node": "A", "worker_clock_id": "mach_continuous_time",
      "worker_clock_resolution_ns": 50,
      "pre_attempt_control_rtt_ns": [
        100001, 100002, 100003, 100004, 100005, 100006, 100007, 100008, 100009, 100010,
        100011, 100012, 100013, 100014, 100015, 100016, 100017, 100018, 100019, 100020,
        100021, 100022, 100023, 100024, 100025, 100026, 100027, 100028, 100029, 100030,
        100031, 100032, 100033, 100034, 100035, 100036, 100037, 100038, 100039, 100040,
        100041, 100042, 100043, 100044, 100045, 100046, 100047, 100048, 100049, 100050,
        100051, 100052, 100053, 100054, 100055, 100056, 100057, 100058, 100059, 100060,
        100061, 100062, 100063, 100064, 100065, 100066, 100067, 100068, 100069, 100070,
        100071, 100072, 100073, 100074, 100075, 100076, 100077, 100078, 100079, 100080,
        100081, 100082, 100083, 100084, 100085, 100086, 100087, 100088, 100089, 100090,
        100091, 100092, 100093, 100094, 100095, 100096, 100097, 100098, 100099, 100100
      ],
      "worker_start_to_ack_ns": 200000,
      "coordinator_ack_receipt_ns": 10005000000
    },
    {
      "flow_id": "b-a", "worker_node": "B", "worker_clock_id": "mach_continuous_time",
      "worker_clock_resolution_ns": 100,
      "pre_attempt_control_rtt_ns": [
        119901, 119902, 119903, 119904, 119905, 119906, 119907, 119908, 119909, 119910,
        119911, 119912, 119913, 119914, 119915, 119916, 119917, 119918, 119919, 119920,
        119921, 119922, 119923, 119924, 119925, 119926, 119927, 119928, 119929, 119930,
        119931, 119932, 119933, 119934, 119935, 119936, 119937, 119938, 119939, 119940,
        119941, 119942, 119943, 119944, 119945, 119946, 119947, 119948, 119949, 119950,
        119951, 119952, 119953, 119954, 119955, 119956, 119957, 119958, 119959, 119960,
        119961, 119962, 119963, 119964, 119965, 119966, 119967, 119968, 119969, 119970,
        119971, 119972, 119973, 119974, 119975, 119976, 119977, 119978, 119979, 119980,
        119981, 119982, 119983, 119984, 119985, 119986, 119987, 119988, 119989, 119990,
        119991, 119992, 119993, 119994, 119995, 119996, 119997, 119998, 119999, 120000
      ],
      "worker_start_to_ack_ns": 250000,
      "coordinator_ack_receipt_ns": 10009000000
    }
  ],
  "derived": {
    "pre_attempt_control_rtt_max_ns": 120000,
    "worker_start_to_ack_max_ns": 250000,
    "timer_resolution_allowance_ns": 150,
    "coordinator_receipt_spread_ns": 4000000,
    "coordinator_observed_start_window_ns": 4620150,
    "inclusion_decision": "included",
    "reasons": []
  },
  "errors": []
}
